{
  "week": 39,
  "year": 2026,
  "themeName": "Outline Gravity",
  "heroVariant": "hierarchy-led",
  "background": "#E7ECE6",
  "foreground": "#121614",
  "accent": "#0E3F32",
  "muted": "#D8E0D8",
  "border": "#C2CDC4",
  "radius": "2px",
  "shadow": "0 8px 24px rgba(18, 22, 20, 0.05)",
  "spacing": {
    "section": "balanced",
    "grid": "comfortable",
    "heroPadding": "generous"
  },
  "typography": {
    "headingMood": "bold",
    "bodyMood": "minimal",
    "scale": "overscaled stacked display with outline-weight supporting lines, comfortable body in supporting bands"
  },
  "motion": {
    "intensity": "subtle",
    "style": "interruptible weight-to-outline shift in the hero; quiet elsewhere; no spring overshoot"
  },
  "hero": {
    "layout": "stacked-type",
    "visualEffect": "kiln-ash field with stacked type; primary line holds gravity while supporting lines recede to outline stroke",
    "interaction": "hover or scroll concentrates weight on the active line; pine accent marks selection only"
  },
  "pageTreatment": {
    "cards": "bordered",
    "sections": "grid-rhythm",
    "navigation": "minimal-border"
  }
}
